{"schema_version":"2.0.0","election_year":2024,"election_type":"presidential","unit":"segment_assignment_status","source_id":"ine_counted_lists","rate_unit":"proportion","data":[{"election_year":2024,"assignment_status":"complementary","LN":13302,"SV":2328,"NV":10127,"NS":847,"source_row_count":12996,"sex_2_source_rows":105,"sex_2_nominal_count":105},{"election_year":2024,"assignment_status":"insufficient_support","LN":47293,"SV":22033,"NV":15620,"NS":9640,"source_row_count":15724,"sex_2_source_rows":0,"sex_2_nominal_count":0},{"election_year":2024,"assignment_status":"supported_candidate","LN":98203780,"SV":54874867,"NV":37079719,"NS":6249194,"source_row_count":9738289,"sex_2_source_rows":0,"sex_2_nominal_count":0},{"election_year":2024,"assignment_status":"undefined_rate","LN":65973,"SV":0,"NV":0,"NS":65973,"source_row_count":6721,"sex_2_source_rows":0,"sex_2_nominal_count":0}],"warnings":["Son segmentos agregados, no personas ni clases naturales descubiertas.","NS representa no especificación, no abstención. Las tasas no definidas son NULL.","Las claves territoriales se consultan dentro de cada elección; no hay equivalencias municipales históricas oficiales validadas.","U/R/M describe secciones electorales, no residencia individual ni localidad.","La lista nominal reportada procede de cuadernillos; no incluye casillas especiales ni voto del extranjero según el diccionario.","Los municipios pueden pertenecer a varios perfiles; su cobertura no se suma entre perfiles.","Los intervalos y el signo relativo son reglas explícitas. Una diferencia cercana a cero requiere cautela."]}